{
  "rewardTypes": {
    "none": {
      "message": {
        "title": "Oops! Maybe next time ☠️",
        "description": "The spirits stayed quiet this time. Thanks for spinning, see you next time!"
      },
      "effectMusic": {
        "enabled": true,
        "value": "HLW_LS_01"
      }
    },
    "discountCode": {
      "message": {
        "title": "🎃 Boo! You Won {{REWARD}}!",
        "description": "Use the code to feed your haunted cart with spooky savings."
      },
      "effectMusic": {
        "enabled": true,
        "value": "HLW_WN_01"
      }
    },
    "freeShipping": {
      "message": {
        "title": "🎃 Boo! You Won {{REWARD}}!",
        "description": "Free shipping is arriving straight from the other side."
      },
      "effectMusic": {
        "enabled": true,
        "value": "HLW_WN_01"
      }
    },
    "freeGift": {
      "message": {
        "title": "🎃 Boo! You Won {{REWARD}}!",
        "description": "The free gift is sealed in cobwebs—claim it before midnight."
      },
      "effectMusic": {
        "enabled": true,
        "value": "HLW_WN_02"
      }
    }
  },
  "opener": {
    "label": {
      "text": "SUMMON REWARD",
      "color": "#FFB84D"
    },
    "icon": {
      "value": "HLW_15",
      "deltaY": -3,
      "transparentBackground": true
    },
    "fontFamily": "Eater",
    "backgroundColor": "#0e0314"
  },
  "popups": {
    "spinPopup": {
      "forms": {
        "spinForm": {
          "title": "🎃 Dare to Spin... If You're Brave Enough!",
          "description": "Summon your prize by entering your name & email... if the spirits will it...",
          "descriptionForExistingAccount": "Hey {{NAME}}... One brave spin seals the ritual — spooky surprises await.",
          "agreement": "I agree to receive spooky updates and offers.",
          "spinButton": "Spin...if you dare!",
          "dismissButton": "Too Spooky, Keep Shopping",
          "footerText": "Only brave souls unlock the prize.",
          "messages": {
            "maxSpinReached": "The spirits say you've spun enough for now."
          }
        },
        "resultForm": {},
        "confirmationForm": {
          "title": "Spooky Win Locked In!"
        }
      },
      "displayType": "full_screen",
      "showLogo": false,
      "backgroundImage": {
        "main": {
          "key": "",
          "url": "/catalog/halloween/themes/HLW_02/background/main.webp"
        },
        "mobile": {
          "key": "",
          "url": "/catalog/halloween/themes/HLW_02/background/main-mobile.webp"
        }
      },
      "backgroundMusic": {
        "enabled": true,
        "value": "HLW_BG_03"
      },
      "playingMusic": {
        "enabled": true,
        "value": "HLW_PY_02"
      }
    },
    "introPopup": {
      "forms": {
        "welcomeForm": {
          "title": "🎃 A Spooktacular Treat Awaits!",
          "description": "Spin the haunted wheel to uncover chilling discounts, free shipping... and maybe a trick or two ☠️",
          "footerText": "Spin the wheel and claim your special reward.",
          "spinButton": "Trick or Treat Me",
          "dismissButton": "Too Spooky, Skip"
        },
        "exitIntentForm": {
          "title": "🎃 A Spooktacular Treat Awaits!",
          "description": "Spin the haunted wheel to uncover chilling discounts, free shipping... and maybe a trick or two ☠️",
          "footerText": "Spin the wheel and claim your special reward.",
          "spinButton": "Trick or Treat Me",
          "dismissButton": "Too Spooky, Skip"
        }
      },
      "backgroundImage": {
        "main": {
          "key": "",
          "url": "/catalog/halloween/themes/HLW_02/background/intro.webp"
        },
        "mobile": {
          "key": "",
          "url": "/catalog/halloween/themes/HLW_02/background/intro-mobile.webp"
        }
      },
      "backgroundOverlay": {}
    },
    "base": {
      "backgroundColor": "#ffffff",
      "fontFamily": "Special Elite",
      "title": {
        "color": "#FFB84D"
      },
      "description": {
        "color": "#E0E0E0"
      },
      "textInput": {
        "color": "#FFFFFF",
        "backgroundColor": "rgb(72 45 76 / 62%)",
        "placeholderColor": "#AAAAAA"
      },
      "helper": {
        "color": "#E0E0E0"
      },
      "footer": {
        "color": "#E0E0E0"
      },
      "primaryButton": {
        "color": "#FFFFFF",
        "backgroundColor": "#da600e"
      },
      "secondaryButton": {
        "color": "#DDDDDD",
        "backgroundColor": "rgba(255,255,255,0.10)"
      },
      "linkButton": {
        "color": "#E0E0E0"
      }
    }
  },
  "announcement": {
    "messages": {
      "upcomingEvent": "🎃 Spirits whisper... The wheel will spin at {{TIME}}. Be prepared!",
      "readyToSpin": "Trick or Treat? Click {{OPENER}} to Spin & Claim Your Reward!",
      "countDownToLaunch": "🎃 Get your courage ready... Wheel unlocks in {{TIME}}!",
      "countDownToClose": "🎃 Last chance! {{TIME}} left to spin the haunted wheel — don't miss it!"
    },
    "fontFamily": "Nosifer",
    "color": "#FFB84D",
    "backgroundColor": "#20072d"
  },
  "id": "HLW_02",
  "wheel": {
    "fontFamily": "Special Elite",
    "border": {
      "type": "line",
      "color": "#FF9933"
    },
    "center": {
      "displayed": true,
      "border": {
        "displayed": true,
        "color": "#FF9933"
      },
      "color": "#FF7518"
    },
    "pointer": {
      "color": "#FF7518",
      "border": {
        "displayed": true,
        "color": "#FF9933"
      }
    },
    "slices": {
      "border": {
        "displayed": true,
        "color": "#FF9933"
      },
      "items": [
        {
          "color": "#DDDDDD",
          "backgroundColor": "#E67E22"
        },
        {
          "color": "#DDDDDD",
          "backgroundColor": "#170B20"
        }
      ]
    }
  }
}