{
  "id": "CLS_07",
  "wheel": {
    "border": {
      "type": "line",
      "color": "#C0C0C0"
    },
    "center": {
      "displayed": true,
      "border": {
        "displayed": true,
        "color": "#C0C0C0"
      },
      "color": "#C0C0C0"
    },
    "pointer": {
      "color": "#C0C0C0",
      "border": {
        "displayed": true,
        "color": "#666666"
      }
    },
    "slices": {
      "border": {
        "displayed": true,
        "color": "#C0C0C0"
      },
      "items": [
        {
          "color": "#FFFFFF",
          "backgroundColor": "#003366"
        },
        {
          "color": "#FFFFFF",
          "backgroundColor": "#001F54"
        }
      ]
    }
  },
  "opener": {
    "icon": {
      "value": "CLS_01"
    },
    "label": {
      "color": "#FFFFFF"
    },
    "backgroundColor": "#003366"
  },
  "popups": {
    "base": {
      "backgroundColor": "#001F54",
      "title": {
        "color": "#C0C0C0"
      },
      "description": {
        "color": "#FFFFFF"
      },
      "textInput": {
        "color": "#FFFFFF"
      },
      "helper": {
        "color": "#FFFFFF"
      },
      "footer": {
        "color": "#FFFFFF"
      },
      "primaryButton": {
        "color": "#FFFFFF",
        "backgroundColor": "#003a74"
      },
      "secondaryButton": {
        "color": "#FFFFFF"
      },
      "linkButton": {
        "color": "#FFFFFF"
      }
    },
    "spinPopup": {
      "backgroundImage": {}
    },
    "introPopup": {
      "backgroundImage": {},
      "backgroundOverlay": {}
    }
  },
  "announcement": {
    "color": "#C0C0C0",
    "backgroundColor": "#001F54"
  }
}