{
  "rewardTypes": {
    "none": {
      "effectMusic": {
        "enabled": true,
        "value": "HLW_LS_01"
      },
      "message": {
        "title": "🎃 No Luck This Time!",
        "description": "The spirits were quiet this time — but your next spin could reveal a spooky surprise."
      }
    },
    "discountCode": {
      "effectMusic": {
        "enabled": true,
        "value": "HLW_WN_01"
      },
      "message": {
        "title": "🎃 Boo! You Won {{REWARD}}!",
        "description": "Use the code below at checkout to unlock your spooky savings."
      }
    },
    "freeShipping": {
      "effectMusic": {
        "enabled": true,
        "value": "HLW_WN_01"
      },
      "message": {
        "title": "🎃 Boo! You Won {{REWARD}}!",
        "description": "Use the code below at checkout to enjoy free shipping from the other side."
      }
    },
    "freeGift": {
      "effectMusic": {
        "enabled": true,
        "value": "HLW_WN_02"
      },
      "message": {
        "title": "🎁 A Spooky Surprise! You Won {{REWARD}}!",
        "description": "Use the code below at checkout to claim your hauntingly good gift."
      }
    }
  },
  "wheel": {
    "fontFamily": "Special Elite",
    "border": {
      "type": "line",
      "color": "#BF2B22"
    },
    "center": {
      "displayed": true,
      "border": {
        "displayed": true,
        "color": "#BF2B22"
      },
      "color": "#B64A1F"
    },
    "pointer": {
      "color": "#B64A1F",
      "border": {
        "displayed": true,
        "color": "#BF2B22"
      }
    },
    "slices": {
      "border": {
        "displayed": true,
        "color": "#BF2B22"
      },
      "items": [
        {
          "color": "#DDDDDD",
          "backgroundColor": "#BF2B22"
        },
        {
          "color": "#DDDDDD",
          "backgroundColor": "#170B20"
        }
      ]
    }
  },
  "opener": {
    "label": {
      "text": "SUMMON REWARD",
      "color": "#ea412b"
    },
    "fontFamily": "Special Elite",
    "icon": {
      "value": "HLW_02"
    },
    "backgroundColor": "#000000"
  },
  "popups": {
    "base": {
      "fontFamily": "Special Elite",
      "backgroundColor": "#ffffff",
      "title": {
        "color": "#ff9c00"
      },
      "description": {
        "color": "#DDDDDD"
      },
      "textInput": {
        "color": "#FFFFFF",
        "backgroundColor": "#2B1B2D9e",
        "placeholderColor": "#AAAAAA"
      },
      "helper": {
        "color": "#DDDDDD"
      },
      "footer": {
        "color": "#DDDDDD"
      },
      "primaryButton": {
        "color": "#ffffff",
        "backgroundColor": "#af3129"
      },
      "secondaryButton": {
        "color": "#DDDDDD",
        "backgroundColor": "rgba(255,255,255,0.10)"
      },
      "linkButton": {
        "color": "#DDDDDD"
      }
    },
    "spinPopup": {
      "displayType": "full_screen",
      "showLogo": false,
      "forms": {
        "spinForm": {
          "title": "🎃 Dare to Spin the Haunted Wheel?",
          "description": "Enter your name and email to summon a spooky surprise.",
          "descriptionForExistingAccount": "{{NAME}}, one brave spin could reveal your Halloween reward.",
          "agreement": "I agree to receive spooky offers and updates.",
          "spinButton": "SPIN IF YOU DARE",
          "dismissButton": "Continue shopping",
          "footerText": "Only brave souls unlock the best surprises.",
          "messages": {
            "maxSpinReached": "The spirits say you’ve used all your spins for now."
          }
        },
        "resultForm": {},
        "confirmationForm": {
          "title": "Your Spooky Reward Is Ready!"
        }
      },
      "backgroundImage": {
        "main": {
          "key": "",
          "url": "/catalog/halloween/themes/HLW_01/background/main.webp"
        },
        "mobile": {
          "key": "",
          "url": "/catalog/halloween/themes/HLW_01/background/main-mobile.webp"
        }
      },
      "backgroundMusic": {
        "enabled": true,
        "value": "HLW_BG_02"
      },
      "playingMusic": {
        "enabled": true,
        "value": "HLW_PY_02"
      }
    },
    "introPopup": {
      "forms": {
        "welcomeForm": {
          "title": "🎃 A Spooky Surprise Awaits!",
          "description": "Spin the haunted wheel for a chance to win discounts, free shipping, and eerie little treats.",
          "footerText": "One spin could unlock your Halloween reward.",
          "spinButton": "Trick or Treat Me",
          "dismissButton": "Maybe Later"
        },
        "exitIntentForm": {
          "title": "🎃 Don’t Leave Your Halloween Reward Behind",
          "description": "Before you go, spin the haunted wheel for a chance to unlock a spooky surprise.",
          "footerText": "A chilling reward could be just one spin away.",
          "spinButton": "Trick or Treat Me",
          "dismissButton": "Maybe Later"
        }
      },
      "backgroundImage": {
        "main": {
          "key": "",
          "url": "/catalog/halloween/themes/HLW_01/background/intro.webp"
        },
        "mobile": {
          "key": "",
          "url": "/catalog/halloween/themes/HLW_01/background/intro-mobile.webp"
        }
      },
      "backgroundOverlay": {}
    }
  },
  "announcement": {
    "fontFamily": "Nosifer",
    "messages": {
      "upcomingEvent": "🎃 The spirits are gathering... the wheel unlocks at {{TIME}}!",
      "readyToSpin": "👻 Trick or treat? Click {{OPENER}} to spin for your Halloween reward!",
      "countDownToLaunch": "⏳ The haunted wheel unlocks in {{TIME}} — get ready!",
      "countDownToClose": "🎃 Last chance! Only {{TIME}} left to spin the haunted wheel!"
    },
    "color": "#ea412b",
    "backgroundColor": "#150000"
  },
  "id": "HLW_01"
}